<?xml version="1.0" encoding="UTF-8"?>
<testplan
    xmlns="http://www.testLocation.com/test"
    xmlns:xsi="http://www.w3.org/2001/XMLSchema-instance"
    xsi:schemaLocation="http://www.testLocation.com/test ../testSchema.xsd">

    <!-- Common tests with both families -->
    <test>
        <name>Common FlexRIO</name>
        <TestFilter>Common.*</TestFilter>
        <TestType>irioCore Functional</TestType>
        <RIODevice>7966</RIODevice>
        <RIOSerial>0x0177A2AD</RIOSerial>
        <RIOModule>noModule</RIOModule>
        <verbose>true</verbose>
    </test>
    <!-- CRIO not supported yet 
    <test>
        <name>Common cRIO</name>
        <TestFilter>Common.*</TestFilter>
        <TestType>irioCore Functional</TestType>
        <RIODevice>9159</RIODevice>
        <RIOSerial>0x01DC7049</RIOSerial>
        <RIOModule>noModule</RIOModule>
        <verbose>true</verbose>
    </test> -->

    <!-- Specific tests -->
    <test>
        <name>FlexRIO Resources</name>
        <TestFilter>FlexRIOResources.*</TestFilter>
        <TestType>irioCore Functional</TestType>
        <RIODevice>7966</RIODevice>
        <RIOSerial>0x0177A2AD</RIOSerial>
        <RIOModule>noModule</RIOModule>
        <verbose>true</verbose>
    </test>
    <test>
        <name>FlexRIO noModule</name>
        <TestFilter>FlexRIOnoModule.*</TestFilter>
        <TestType>irioCore Functional</TestType>
        <RIODevice>7966</RIODevice>
        <RIOSerial>0x0177A2AD</RIOSerial>
        <RIOModule>noModule</RIOModule>
        <verbose>true</verbose>
    </test>
    <test>
        <name>FlexRIO DAQ</name>
        <TestFilter>FlexRIODAQ5761.*</TestFilter>
        <TestType>irioCore Functional</TestType>
        <RIODevice>7966</RIODevice>
        <RIOSerial>0x01A34CC7</RIOSerial>
        <RIOModule>NI5761</RIOModule>
        <verbose>true</verbose>
    </test>
    <test>
        <name>FlexRIO DIO</name>
        <TestFilter>FlexRIODIO6581.*</TestFilter>
        <TestType>irioCore Functional</TestType>
        <RIODevice>7965</RIODevice>
        <RIOSerial>0x01666C59</RIOSerial>
        <RIOModule>NI6581</RIOModule>
        <verbose>true</verbose>
    </test>
    <test>
        <name>FlexRIO IMAQ</name>
        <TestFilter>FlexRIOIMAQ1483.*</TestFilter>
        <TestType>irioCore Functional</TestType>
        <RIODevice>7966</RIODevice>
        <RIOSerial>0x0177A2AD</RIOSerial>
        <RIOModule>NI1483</RIOModule>
        <verbose>true</verbose>
    </test>
    <test>
        <name>FlexRIO UART</name>
        <TestFilter>FlexRIOUART1483.*</TestFilter>
        <TestType>irioCore Functional</TestType>
        <RIODevice>7966</RIODevice>
        <RIOSerial>0x0177A2AD</RIOSerial>
        <RIOModule>NI1483</RIOModule>
        <verbose>true</verbose>
    </test>

    <!-- CRIO not supported yet 
    <test>
        <name>cRIO IO</name>
        <TestFilter>cRIO.*</TestFilter>
        <TestType>irioCore Functional</TestType>
        <RIODevice>9159</RIODevice>
        <RIOSerial>0x01DC7049</RIOSerial>
        <RIOModule>NI92xx</RIOModule>
        <verbose>true</verbose>
    </test> -->

    <!-- Error tests -->
    <test>
        <name>IRIOError</name>
        <TestFilter>IRIOError.*</TestFilter>
        <TestType>irioCore Functional</TestType>
        <RIODevice>7966</RIODevice>
        <RIOSerial>0x0177A2AD</RIOSerial>
        <RIOModule>noModule</RIOModule>
        <verbose>true</verbose>
    </test>

</testplan>