<?xml version="1.0" encoding="UTF-8"?>
<testplan
    xmlns="http://www.testLocation.com/test"
    xmlns:xsi="http://www.w3.org/2001/XMLSchema-instance"
    xsi:schemaLocation="http://www.testLocation.com/test ../testSchema.xsd">

    <!-- Common tests with both families -->
    <test>
        <name>Common Tests</name>
        <TestFilter>CommonTests.*</TestFilter>
        <TestType>irioCoreCpp Functional</TestType>
        <RIODevice>%%%COMMONDEVICE%%%</RIODevice>
        <RIOSerial>%%%COMMONSERIAL%%%</RIOSerial>
        <RIOModule>noModule</RIOModule>
        <verbose>%%%VERBOSE%%%</verbose>
    </test>

    <test>
        <name>Common Tests Resources</name>
        <TestFilter>CommonTestsResources.*</TestFilter>
        <TestType>irioCoreCpp Functional</TestType>
        <RIODevice>%%%COMMONDEVICE%%%</RIODevice>
        <RIOSerial>%%%COMMONSERIAL%%%</RIOSerial>
        <RIOModule>noModule</RIOModule>
        <verbose>%%%VERBOSE%%%</verbose>
    </test>

    <test>
        <name>Common Tests Error</name>
        <TestFilter>CommonTestsError.*</TestFilter>
        <TestType>irioCoreCpp Functional</TestType>
        <RIODevice>%%%COMMONDEVICE%%%</RIODevice>
        <RIOSerial>%%%COMMONSERIAL%%%</RIOSerial>
        <RIOModule>noModule</RIOModule>
        <verbose>%%%VERBOSE%%%</verbose>
    </test>

    <test>
        <name>FlexRIO IMAQ</name>
        <TestFilter>FlexRIOCPUIMAQ.*</TestFilter>
        <TestType>irioCoreCpp Functional</TestType>
        <RIODevice>%%%IMAQDEVICE%%%</RIODevice>
        <RIOSerial>%%%IMAQSERIAL%%%</RIOSerial>
        <RIOModule>NI1483</RIOModule>
        <verbose>%%%VERBOSE%%%</verbose>
    </test>

    <test>
        <name>FlexRIO CPUDAQ Mod6581</name>
        <TestFilter>FlexRIOCPUDAQMod6581.*</TestFilter>
        <TestType>irioCoreCpp Functional</TestType>
        <RIODevice>%%%DAQDEVICE%%%</RIODevice>
        <RIOSerial>%%%DAQSERIAL%%%</RIOSerial>
        <RIOModule>NI6581</RIOModule>
        <verbose>%%%VERBOSE%%%</verbose>
    </test>

    <test>
        <name>FlexRIO CPUDAQ Mod5761</name>
        <TestFilter>FlexRIOCPUDAQMod5761.*</TestFilter>
        <TestType>irioCoreCpp Functional</TestType>
        <RIODevice>%%%DAQDEVICE%%%</RIODevice>
        <RIOSerial>%%%DAQSERIAL%%%</RIOSerial>
        <RIOModule>NI5761</RIOModule>
        <verbose>%%%VERBOSE%%%</verbose>
    </test>

    <test>
        <name>FlexRIO CPUDAQ Mod5761 Error</name>
        <TestFilter>FlexRIOCPUDAQMod5761Error.*</TestFilter>
        <TestType>irioCoreCpp Functional</TestType>
        <RIODevice>%%%DAQDEVICE%%%</RIODevice>
        <RIOSerial>%%%DAQSERIAL%%%</RIOSerial>
        <RIOModule>NI5761</RIOModule>
        <verbose>%%%VERBOSE%%%</verbose>
    </test>

    <test>
        <name>FlexRIO CPUDAQ</name>
        <TestFilter>FlexRIOCPUDAQ.*</TestFilter>
        <TestType>irioCoreCpp Functional</TestType>
        <RIODevice>%%%DAQDEVICE%%%</RIODevice>
        <RIOSerial>%%%DAQSERIAL%%%</RIOSerial>
        <RIOModule>NI6581</RIOModule>
        <verbose>%%%VERBOSE%%%</verbose>
    </test>

    <test>
        <name>FlexRIO CPUDAQ Error</name>
        <TestFilter>FlexRIOCPUDAQError.*</TestFilter>
        <TestType>irioCoreCpp Functional</TestType>
        <RIODevice>%%%DAQDEVICE%%%</RIODevice>
        <RIOSerial>%%%DAQSERIAL%%%</RIOSerial>
        <RIOModule>NI6581</RIOModule>
        <verbose>%%%VERBOSE%%%</verbose>
    </test>

    <!-- CRIO not supported yet 
    <test>
        <name>cRIO IO</name>
        <TestFilter>CRIOIO.*</TestFilter>
        <TestType>irioCore Functional</TestType>
        <RIODevice>%%%CRIODEVICE%%%</RIODevice>
        <RIOSerial>%%%CRIOSERIAL%%%</RIOSerial>
        <RIOModule>NI92xx</RIOModule>
        <verbose>%%%VERBOSE%%%</verbose>
    </test> 

    <test>
        <name>CRIO CPUDAQ</name>
        <TestFilter>CRIOCPUDAQ.*</TestFilter>
        <TestType>irioCore Functional</TestType>
        <RIODevice>%%%CRIODEVICE%%%</RIODevice>
        <RIOSerial>%%%CRIOSERIAL%%%</RIOSerial>
        <RIOModule>NI92xx</RIOModule>
        <verbose>%%%VERBOSE%%%</verbose>
    </test> -->


</testplan>