
<?xml version="1.0" encoding="UTF-8"?>
<testplan
    xmlns="http://www.testLocation.com/test"
    xmlns:xsi="http://www.w3.org/2001/XMLSchema-instance"
    xsi:schemaLocation="http://www.testLocation.com/test ../testSchema.xsd">

    <test>
        <name>BFP</name>
        <TestType>BFP</TestType>
        <verbose>false</verbose>
    </test>

    <test>
        <name>irioCoreUnit</name>
        <TestType>irioCore Unitary</TestType>
        <verbose>false</verbose>
    </test>

    <test>
        <name>irioCoreCppUnit</name>
        <TestType>irioCoreCpp Unitary</TestType>
        <verbose>false</verbose>
    </test>

</testplan>